{"auction_id":"6388f2cd0d63823c339c6c014b0ce400c52a86896e99ea4820da161642b412d3","beacon":{"chain_hash":"52db9ba70e0cc0f6eaf7803dd07447a1f5477735fd3f661792ba94600c84e971","round":32701714,"signature":"93f43c750eb80e6743445fe05089cf8155627f46c05ad0d878281afb588b2eeae1c28d622df24f6cf8052df179555fb1"},"frozen":{"auction_id":"6388f2cd0d63823c339c6c014b0ce400c52a86896e99ea4820da161642b412d3","cutoff":1790908386,"leaf_count":10,"leaves":[{"auction_id":"6388f2cd0d63823c339c6c014b0ce400c52a86896e99ea4820da161642b412d3","ciphertext_hash":"f39865c603f615edf11594b9d3edb0edbb2674f17934473115dbdeaee967f81a","ciphertext_hex":"6167652d656e6372797074696f6e2e6f72672f76310a2d3e20746c6f636b20333237303137313420353264623962613730653063633066366561663738303364643037343437613166353437373733356664336636363137393262613934363030633834653937310a6a616e5a6471445179633845507159726c65637a3377593969584b71617458725350617737465975446a434e7079555645764c7446484855426a71384b3537510a444a45444671506d6175694e4f426d4e52745353364e6b484c445948526f67596943356a657a6f454b4668585a6f354d337631372b46482f6542716e34596c4b0a5558704f6e4250664b49323264785a574463536357313461476765766178537442674a6f504f784d7738770a2d2d2d205551393633504c4e766e70707135337558575148704b3072703648384b4e6676526a7350535250635372670a9d25a8596bdd84becd0482ba6b4a65293a2080b4d02125a0aabe290851a88b4aa3b031a938c0e43a4ea38f5b98f6c138456db4798d50b2dd08160be6066c5c1bac4e837301cc81811d72e2647edfd355b3c9232a3e726330c062364d08e4fdae6576ea51ccd1344f7f60cf7d28064cff621b8ac4705196249fc57a1d5abee0d01e22377044d448e4f9007d26a30ba63c4cefd35a8a4dd92a829db1fa60d345ff","deposit":{"address":"utest1redacted","diversifier_index":"4608233002","pool":"ironwood","txid":"b47e9516d6ee01e42d3d7d1705bf3716f86f0efb414dcdbda0179de16ff3e61d"},"leaf_index":0,"manifest_hash":"ae000a3f80f40393a6de246b1924ec14a9240dda7296f260dbef4200912d605c"},{"auction_id":"6388f2cd0d63823c339c6c014b0ce400c52a86896e99ea4820da161642b412d3","ciphertext_hash":"8fe8da8b3673a019201382ded57646d676a287db8833fa4cd3bb3025f44e9241","ciphertext_hex":"6167652d656e6372797074696f6e2e6f72672f76310a2d3e20746c6f636b20333237303137313420353264623962613730653063633066366561663738303364643037343437613166353437373733356664336636363137393262613934363030633834653937310a674b724d4f4c7148577841687a72594b2f512f3959742b787566707677726f346b4f6d4f4b77306c6441336f6155476531364368517658696d6c4a444457456c0a4337433769396d7658675a58424f6a4f436c494d44776f49305766506352546742483950426a5768706c626b4b476a674a4d31446b4e7a4245753562754577550a6f576b716839395343656858484b2b7a4576796465314c6b4a384c776a524c4845474b4d364e50565965510a2d2d2d20565a714f6d6b61344858447748484d6745684a535338644444464f34577479372f3449514d4472785279770ab76cdda295e57c69fb1f5bf34a1856c7e0b9db1f3f42a1e224b4e280017ab63949058021ff204dd4c379bb191c1af1a8e97b2a024b5dae3478fad6cd91ba1d80f02d7ab21a899db4b84c423eedccc5545dddd8a59c98cdb1d597a096cc67373dd4f77c6333afeef01799521bb3360961c9024f97e6fdb9a2f7bc198a813383b4425c978c0c1cc852f06063db187fade4a6f9866ab9eaa486f4f3cd6af8a3ab14","deposit":{"address":"utest1redacted","diversifier_index":"4608233003","pool":"ironwood","txid":"b47e9516d6ee01e42d3d7d1705bf3716f86f0efb414dcdbda0179de16ff3e61d"},"leaf_index":1,"manifest_hash":"ae000a3f80f40393a6de246b1924ec14a9240dda7296f260dbef4200912d605c"},{"auction_id":"6388f2cd0d63823c339c6c014b0ce400c52a86896e99ea4820da161642b412d3","ciphertext_hash":"492d9f99984d752e953ca2daeb295b010a3163796073b898c8e2b486b82ce935","ciphertext_hex":"6167652d656e6372797074696f6e2e6f72672f76310a2d3e20746c6f636b20333237303137313420353264623962613730653063633066366561663738303364643037343437613166353437373733356664336636363137393262613934363030633834653937310a6a4144316d6e494c57684b574d55796c486168646a526a555430557a546653433036776e4b4e30525852475073622b5648675a7566467a647874354d566755780a462f4b75472f30664d33765438326571453946684271526b574c556862514465677259673732465132716e4f693332664f2f5057617678484266784e784d6a350a772f6e59645a6c6b4132356d636e5a595934367147356f336347756d77436e694d2f4d4746686e434253340a2d2d2d20435747614c454763796a7639444c467862494c7267395531656375614763734b76446e68795734487575380a10baef7d630b9ecab6afbc8483bc5ce30cac712ef938083c4af88b72b93807284b392ee68ad8ed68806a0bdf6b7019d9718da4b9e83e7b0c3eb5c0d39c916e44ab0603f3d680750473aabdbd978c90f81072d5c50b95d635d727ff57c83b08a8d74eb34a78cc5c49e6832a48f9abf9c16a8bc3e5eab9e113b96449244118ab58f85670e1daaa6b749bd895c795fd800d2e74154bace2ec8a1e0d34787df2d2f6","deposit":{"address":"utest1redacted","diversifier_index":"4608233004","pool":"ironwood","txid":"b47e9516d6ee01e42d3d7d1705bf3716f86f0efb414dcdbda0179de16ff3e61d"},"leaf_index":2,"manifest_hash":"ae000a3f80f40393a6de246b1924ec14a9240dda7296f260dbef4200912d605c"},{"auction_id":"6388f2cd0d63823c339c6c014b0ce400c52a86896e99ea4820da161642b412d3","ciphertext_hash":"680f6ae682b8da7346f43e6b818d4ace91a5908716da6aeece5bc7bfbae678f7","ciphertext_hex":"6167652d656e6372797074696f6e2e6f72672f76310a2d3e20746c6f636b20333237303137313420353264623962613730653063633066366561663738303364643037343437613166353437373733356664336636363137393262613934363030633834653937310a734d366d737072375444674a3538464a756254702b34455a7365316a597831634d7a7776714d436c4176643667356d31325450706e6674526e417341612f6a630a41454e327262625144347a4c4a4c2b6e676237786b767050456269394d305573696b7443425467357748594c326f6b71454f7a654c67596b6c68766177594e440a7934355a735150486165614d6552616a6159584c666e5a304d7850674d33516b3270622f796f362b792b340a2d2d2d206b4d2b5046374658416c643735584b6a354648724c5575354458743961354435487a632b426658776b38770a733b7d9cac4133daccbadbf4db4af1e8199455921bc5c50482118a8d48a2380d59f2ff17ad6e9d3d308dd0244ecdab3d1c8dce1354b3880ffed42a93715d005feb2ef2d312673de64705974093b45ebeb45caaaccd5346e5786db2a5332f728cccfc34fcd01734d3325f0e085324f70c5736eaff471d444b26ed8fb395ab8ce6ecd74a16b91507a52dc293ccb093f42006686e3a49c342f26c17e9246db60e1e","deposit":{"address":"utest1redacted","diversifier_index":"4608233005","pool":"ironwood","txid":"b47e9516d6ee01e42d3d7d1705bf3716f86f0efb414dcdbda0179de16ff3e61d"},"leaf_index":3,"manifest_hash":"ae000a3f80f40393a6de246b1924ec14a9240dda7296f260dbef4200912d605c"},{"auction_id":"6388f2cd0d63823c339c6c014b0ce400c52a86896e99ea4820da161642b412d3","ciphertext_hash":"4a3525767b80b48a6ca6a079b983d7f2e619e82ae13529c352d27d8834f1ae29","ciphertext_hex":"6167652d656e6372797074696f6e2e6f72672f76310a2d3e20746c6f636b20333237303137313420353264623962613730653063633066366561663738303364643037343437613166353437373733356664336636363137393262613934363030633834653937310a6f7a6a414863692b6153596a5242505332514e3165663643534b59685269314c324347417332544450613173426e50347179747944776c7668525a4e517444310a4435445a70576b6c7a3675523862783647314f70486b4f4b765732474f4b6a6837415852324b76625466466d53634e34486546764f6b7a7a4b493757356461750a6c2b6149426f664e6675456b523753775252486e795548666b587a4532723153643339576c62586e66724d0a2d2d2d20693244766e4147566878416f2b64694d612f396a636a7a467964575a545452567874454f49584d67626f670a3746295e3567b973f2a8b35df8211723c39ca1fd1225c1abd4ddf14bd9aca002ff9446b8de3ffa25b6fd016ad734717c34d49f2d81dc7afc4ca70909b8ea006ab8f3f38ecc8eb994ee5627bb8f1110c35b1614303b6822b51e15bd1bea73ee7a315d91a5670c8fd98c9629d6dcf87a993fb8e4d13295e1eae99593a629bc0bc7d309bf36fdcb433a8fe55ed5a5bb4a5ee474e8f419719d1d0a4626f63ea554cc","deposit":{"address":"utest1redacted","diversifier_index":"4608233006","pool":"ironwood","txid":"b47e9516d6ee01e42d3d7d1705bf3716f86f0efb414dcdbda0179de16ff3e61d"},"leaf_index":4,"manifest_hash":"ae000a3f80f40393a6de246b1924ec14a9240dda7296f260dbef4200912d605c"},{"auction_id":"6388f2cd0d63823c339c6c014b0ce400c52a86896e99ea4820da161642b412d3","ciphertext_hash":"845af67790e36e16fa99ab1f5382bc11f55914aa57f499d45eb039533f92e521","ciphertext_hex":"6167652d656e6372797074696f6e2e6f72672f76310a2d3e20746c6f636b20333237303137313420353264623962613730653063633066366561663738303364643037343437613166353437373733356664336636363137393262613934363030633834653937310a71674970374166486a742f41494b316a35625157646d2f6c48486975706a324356524c41614b37665332676474526659474b396f6e6d51644761384f684d4e4f0a4669556d6e6b384f6242302f4f663069382f6d69485a756f566b75504b626a3932666d44505a32526578396741386b4b6d4d575a4b74677970755241457847780a456e726d6d664576676762484d6656597a55446e5648774d5073524b7456724657384e79775664686577770a2d2d2d203670346f745a3336515337546c356447782b6f66706a636963344950746875435069465637622f5147536f0ab5cd06fc65bbe2a5600a04bc7e128a06e0cb221d5cb203297bc6692aed583d04827ab25124cac89a4f678229969fbf0e1385ea630ab160c60b2e70c684c58d10c53f77f4415a1a6df157a8ab02c4b1b067a02c6e9f7e313248919de18de223f9df080c0376654921bcace7b5a50a25c90c3cf905b16c3baa91854d33dcb136f0c2c6550f3681b0a549b659bfc82678320820b1b88ee32783748cb0be86fcc0cc","deposit":{"address":"utest1redacted","diversifier_index":"4608233007","pool":"ironwood","txid":"b47e9516d6ee01e42d3d7d1705bf3716f86f0efb414dcdbda0179de16ff3e61d"},"leaf_index":5,"manifest_hash":"ae000a3f80f40393a6de246b1924ec14a9240dda7296f260dbef4200912d605c"},{"auction_id":"6388f2cd0d63823c339c6c014b0ce400c52a86896e99ea4820da161642b412d3","ciphertext_hash":"deed439eb41ec132a82a21257dac0574af37212713f1ed13ed51f65da0d1f06e","ciphertext_hex":"6167652d656e6372797074696f6e2e6f72672f76310a2d3e20746c6f636b20333237303137313420353264623962613730653063633066366561663738303364643037343437613166353437373733356664336636363137393262613934363030633834653937310a6c386865324a434a655a35423577634d79765771753034745350666964716b34764651566d504c4739503963756364576b5462694a62426661374f77453377440a434a5a585053774e4f49366b2f772b6f74572b33504b73547a42432b386342736e65324a526d5868436b7859624530516b7456684c39354d3954324c785942340a666a6b7a764b6139486d577a347656457962536c57555a752b363275666253545650574f637270497172590a2d2d2d207249513339324271323835357a513135646f7a585a4d78694d7750726e4d537673332b46486b446a5a71410a4555a0cff21722535e1df7bd42b0f8442c733013043882ec41cca460577121a7af6392165e2dd0447f6df9b1d8e6cecdc7fcda3941079ffcae8119909cbcfd974cbec448d6d37bcff4853b49bcbb1582e9226f94c54057df37a82fb04353